id,question,tags,subject,skill_code,subskill_code,difficulty
q-manual-1772157472411,Nối bốn điểm nào trong hình vẽ để được một hình bình hành?,"#hinh_binh_hanh,#hinh_hoc,#toan",math,hinh_hoc_co_ban,hinh_hoc,2
q-manual-1772158258558,Chọn đáp án đúng. Hình bình hành ABCD có:,"#hinh_binh_hanh,#hinh_hoc,#toan",math,hinh_hoc_co_ban,hinh_hoc,2
q-manual-1772158770684,Trong hình bình hành ABCD:,"#hinh_binh_hanh,#hinh_hoc,#toan",math,hinh_hoc_co_ban,hinh_hoc,2
q-manual-1772161143133,Cho hình bình hành ABCD (như hình vẽ). Các cặp cạnh  song song với nhau là:,"#hinh_binh_hanh,#hinh_hoc,#toan",math,hinh_hoc_co_ban,hinh_hoc,2
q-manual-1772170285564,Chọn tất cả các đáp án đúng. Hình bình hành là hình nào dưới đây?,"#hinh_binh_hanh,#hinh_hoc,#toan",math,hinh_hoc_co_ban,hinh_hoc,2
q-manual-1772170491719,Chọn đáp án đúng nhất. Hình bình hành là hình thế nào?,"#hinh_binh_hanh,#hinh_hoc,#toan",math,hinh_hoc_co_ban,hinh_hoc,2
q-manual-1772414734609,Hình nào dưới đây là hình bình hành,"#hinh_binh_hanh,#hinh_hoc,#toan",math,hinh_hoc_co_ban,hinh_hoc,2